{
  "schema": "dusk.files/v1",
  "id": "01a112fe-d1bd-704c-9bd1-2341affe105d",
  "time": "2026-10-06T09:16:30.512408267Z",
  "pid": "13792273858822192861",
  "campaign_id": "0192f3a4-5b6c-7d8e-9f01-23456789abcd",
  "device_id": "3f9c0e2a7b5d4c1e8a6f0b2d9e7c5a13",
  "installation_id": "a41e6c2f9b0d4e7a8c3f5b1d2e9a6c70",
  "namespace_id": "5d2e9a1c7b3f8e04",
  "node_path": "/var/run/dusk.pid",
  "bucket": "dusk-files",
  "object_key": "files/3f9c0e2a7b5d4c1e8a6f0b2d9e7c5a13/a41e6c2f9b0d4e7a8c3f5b1d2e9a6c70/13792273858822192861/1-dusk.pid",
  "size_bytes": 0,
  "sha256": "e3b0c44298fc1c149afbf4c8996fb92427ae41e4649b934ca495991b7852b855",
  "content_type": "text/plain",
  "uploaded_at": "2026-10-06T09:16:09.811002004Z",
  "dawn_instance": "dawn-0"
}
